{
  "schemaVersion": "3.0.0",
  "id": "learn-sprunki-catalogue",
  "title": "LearnSprunki Lessons",
  "games": [
    {
      "id": "original-sprunki",
      "title": "Original Sprunki",
      "manifest": "./extensions/learn-sprunki/content/games/original-sprunki/game.json"
    }
  ],
  "resources": {
    "instruments": "./extensions/learn-sprunki/content/instruments/catalog.json",
    "effects": "./extensions/learn-sprunki/content/effects/catalog.json"
  },
  "tracks": [
    {
      "id": "orange-oren-phase1-draft",
      "title": "Oren — Phase 1",
      "subtitle": "Draft rhythm lesson · Kick",
      "filename": "orange-oren-phase1-draft-rhythm.mid",
      "emoji": "🥁",
      "midi": "./extensions/learn-sprunki/content/tracks/orange-oren-phase1/lesson/orange-oren-phase1-draft-rhythm.mid",
      "kind": "sprunki-lesson",
      "reviewStatus": "draft",
      "lesson": {
        "gameId": "original-sprunki",
        "characterId": "orange-oren",
        "phaseId": "phase1",
        "playerMode": "rhythm",
        "loopByDefault": true,
        "loopDurationMs": 4968.753,
        "instrumentId": "percussion",
        "effectId": "impact-sparks",
        "rhythmLabel": "Kick",
        "rhythmMidiNote": 36,
        "referenceAudio": "./extensions/learn-sprunki/content/tracks/orange-oren-phase1/audio/kick.wav",
        "theme": {
          "primary": "#ff7a00",
          "secondary": "#ffa24d",
          "leftHand": "#ff8a1f",
          "rightHand": "#ffa24d",
          "background": "#1f0f00"
        },
        "animation": {
          "idle": "./extensions/learn-sprunki/content/tracks/orange-oren-phase1/animation/idle.svg",
          "frames": [
            "./extensions/learn-sprunki/content/tracks/orange-oren-phase1/animation/anim.svg",
            "./extensions/learn-sprunki/content/tracks/orange-oren-phase1/animation/anim2.svg",
            "./extensions/learn-sprunki/content/tracks/orange-oren-phase1/animation/anim3.svg",
            "./extensions/learn-sprunki/content/tracks/orange-oren-phase1/animation/anim4.svg",
            "./extensions/learn-sprunki/content/tracks/orange-oren-phase1/animation/anim5.svg",
            "./extensions/learn-sprunki/content/tracks/orange-oren-phase1/animation/anim6.svg"
          ],
          "frameDurationMs": 116
        }
      },
      "transcription": {
        "engine": "energy-onset-detector",
        "engineVersion": "1.0.0",
        "sourceAudio": "apps/player/extensions/learn-sprunki/source-assets/sprunkis/orange-oren/sounds/phase1/kick.wav",
        "reviewRequired": true,
        "parameters": {
          "detector": "energy-novelty-v1",
          "rhythmMidiNote": 36,
          "category": "percussion"
        }
      }
    },
    {
      "id": "orange-oren-phase2-draft",
      "title": "Oren — Phase 2",
      "subtitle": "Draft rhythm lesson · Kick",
      "filename": "orange-oren-phase2-draft-rhythm.mid",
      "emoji": "🥁",
      "midi": "./extensions/learn-sprunki/content/tracks/orange-oren-phase2/lesson/orange-oren-phase2-draft-rhythm.mid",
      "kind": "sprunki-lesson",
      "reviewStatus": "draft",
      "lesson": {
        "gameId": "original-sprunki",
        "characterId": "orange-oren",
        "phaseId": "phase2",
        "playerMode": "rhythm",
        "loopByDefault": true,
        "loopDurationMs": 9245.533,
        "instrumentId": "percussion",
        "effectId": "impact-sparks",
        "rhythmLabel": "Kick",
        "rhythmMidiNote": 36,
        "referenceAudio": "./extensions/learn-sprunki/content/tracks/orange-oren-phase2/audio/kick3.wav",
        "theme": {
          "primary": "#ff7a00",
          "secondary": "#ffa24d",
          "leftHand": "#ff8a1f",
          "rightHand": "#ffa24d",
          "background": "#1f0f00"
        },
        "animation": {
          "idle": "./extensions/learn-sprunki/content/tracks/orange-oren-phase2/animation/idle.svg",
          "frames": [
            "./extensions/learn-sprunki/content/tracks/orange-oren-phase2/animation/anim.svg",
            "./extensions/learn-sprunki/content/tracks/orange-oren-phase2/animation/anim2.svg",
            "./extensions/learn-sprunki/content/tracks/orange-oren-phase2/animation/anim3.svg",
            "./extensions/learn-sprunki/content/tracks/orange-oren-phase2/animation/anim4.svg"
          ],
          "frameDurationMs": 116
        }
      },
      "transcription": {
        "engine": "energy-onset-detector",
        "engineVersion": "1.0.0",
        "sourceAudio": "apps/player/extensions/learn-sprunki/source-assets/sprunkis/orange-oren/sounds/phase2/kick3.wav",
        "reviewRequired": true,
        "parameters": {
          "detector": "energy-novelty-v1",
          "rhythmMidiNote": 36,
          "category": "percussion"
        }
      }
    },
    {
      "id": "red-raddy-phase1-draft",
      "title": "Raddy — Phase 1",
      "subtitle": "Draft rhythm lesson · Snare",
      "filename": "red-raddy-phase1-draft-rhythm.mid",
      "emoji": "🥁",
      "midi": "./extensions/learn-sprunki/content/tracks/red-raddy-phase1/lesson/red-raddy-phase1-draft-rhythm.mid",
      "kind": "sprunki-lesson",
      "reviewStatus": "draft",
      "lesson": {
        "gameId": "original-sprunki",
        "characterId": "red-raddy",
        "phaseId": "phase1",
        "playerMode": "rhythm",
        "loopByDefault": true,
        "loopDurationMs": 5175.011,
        "instrumentId": "percussion",
        "effectId": "impact-sparks",
        "rhythmLabel": "Snare",
        "rhythmMidiNote": 38,
        "referenceAudio": "./extensions/learn-sprunki/content/tracks/red-raddy-phase1/audio/snare.wav",
        "theme": {
          "primary": "#ed3434",
          "secondary": "#f27171",
          "leftHand": "#ef4c4c",
          "rightHand": "#f27171",
          "background": "#1c0606"
        },
        "animation": {
          "idle": "./extensions/learn-sprunki/content/tracks/red-raddy-phase1/animation/idle.svg",
          "frames": [
            "./extensions/learn-sprunki/content/tracks/red-raddy-phase1/animation/anim.svg",
            "./extensions/learn-sprunki/content/tracks/red-raddy-phase1/animation/anim2.svg",
            "./extensions/learn-sprunki/content/tracks/red-raddy-phase1/animation/anim3.svg",
            "./extensions/learn-sprunki/content/tracks/red-raddy-phase1/animation/anim4.svg"
          ],
          "frameDurationMs": 116
        }
      },
      "transcription": {
        "engine": "energy-onset-detector",
        "engineVersion": "1.0.0",
        "sourceAudio": "apps/player/extensions/learn-sprunki/source-assets/sprunkis/red-raddy/sounds/phase1/snare.wav",
        "reviewRequired": true,
        "parameters": {
          "detector": "energy-novelty-v1",
          "rhythmMidiNote": 38,
          "category": "percussion"
        }
      }
    },
    {
      "id": "red-raddy-phase2-draft",
      "title": "Raddy — Phase 2",
      "subtitle": "Draft rhythm lesson · Snare",
      "filename": "red-raddy-phase2-draft-rhythm.mid",
      "emoji": "🥁",
      "midi": "./extensions/learn-sprunki/content/tracks/red-raddy-phase2/lesson/red-raddy-phase2-draft-rhythm.mid",
      "kind": "sprunki-lesson",
      "reviewStatus": "draft",
      "lesson": {
        "gameId": "original-sprunki",
        "characterId": "red-raddy",
        "phaseId": "phase2",
        "playerMode": "rhythm",
        "loopByDefault": true,
        "loopDurationMs": 11540.181,
        "instrumentId": "percussion",
        "effectId": "impact-sparks",
        "rhythmLabel": "Snare",
        "rhythmMidiNote": 38,
        "referenceAudio": "./extensions/learn-sprunki/content/tracks/red-raddy-phase2/audio/snare3.wav",
        "theme": {
          "primary": "#ed3434",
          "secondary": "#f27171",
          "leftHand": "#ef4c4c",
          "rightHand": "#f27171",
          "background": "#1c0606"
        },
        "animation": {
          "idle": "./extensions/learn-sprunki/content/tracks/red-raddy-phase2/animation/idle.svg",
          "frames": [
            "./extensions/learn-sprunki/content/tracks/red-raddy-phase2/animation/anim.svg",
            "./extensions/learn-sprunki/content/tracks/red-raddy-phase2/animation/anim2.svg",
            "./extensions/learn-sprunki/content/tracks/red-raddy-phase2/animation/anim3.svg",
            "./extensions/learn-sprunki/content/tracks/red-raddy-phase2/animation/anim4.svg",
            "./extensions/learn-sprunki/content/tracks/red-raddy-phase2/animation/anim5.svg"
          ],
          "frameDurationMs": 116
        }
      },
      "transcription": {
        "engine": "energy-onset-detector",
        "engineVersion": "1.0.0",
        "sourceAudio": "apps/player/extensions/learn-sprunki/source-assets/sprunkis/red-raddy/sounds/phase2/snare3.wav",
        "reviewRequired": true,
        "parameters": {
          "detector": "energy-novelty-v1",
          "rhythmMidiNote": 38,
          "category": "percussion"
        }
      }
    },
    {
      "id": "silver-clukr-phase1-draft",
      "title": "Clukr — Phase 1",
      "subtitle": "Draft rhythm lesson · Ride",
      "filename": "silver-clukr-phase1-draft-rhythm.mid",
      "emoji": "🔔",
      "midi": "./extensions/learn-sprunki/content/tracks/silver-clukr-phase1/lesson/silver-clukr-phase1-draft-rhythm.mid",
      "kind": "sprunki-lesson",
      "reviewStatus": "draft",
      "lesson": {
        "gameId": "original-sprunki",
        "characterId": "silver-clukr",
        "phaseId": "phase1",
        "playerMode": "rhythm",
        "loopByDefault": true,
        "loopDurationMs": 5106.25,
        "instrumentId": "percussion",
        "effectId": "bright-sparks",
        "rhythmLabel": "Ride",
        "rhythmMidiNote": 51,
        "referenceAudio": "./extensions/learn-sprunki/content/tracks/silver-clukr-phase1/audio/ride-cymbal.wav",
        "theme": {
          "primary": "#b7c1cc",
          "secondary": "#cdd4db",
          "leftHand": "#c0c8d2",
          "rightHand": "#cdd4db",
          "background": "#161718"